{
  "version": "2.4.0-semantic-promotion-ladder",
  "transition_policy": {
    "generated_draft_to_reviewed": [
      "no generated-template summary or force",
      "term-specific shadow",
      "at least one prompt-use clause",
      "at least one concrete example clause",
      "sense disambiguation for overloaded terms"
    ],
    "reviewed_to_canonical": [
      "used by a spell, stack, benchmark, or accepted external report",
      "stable across at least one release",
      "no unresolved canon-correction issue"
    ]
  },
  "summary": {
    "total_entries": 1645,
    "generated_draft_entries": 1135,
    "reviewed_or_canonical_entries": 510,
    "fully_reviewed_houses": 2,
    "target_reviewed_entries": 450
  },
  "houses": [
    {
      "house": "architecture-abstraction-and-design",
      "house_name": "Architecture, Abstraction, and Design",
      "total_entries": 112,
      "generated_draft_entries": 0,
      "reviewed_entries": 112,
      "canonical_entries": 0,
      "fully_reviewed": true,
      "next_tranche": "complete",
      "last_review_release": "v2.4.0-semantic-promotion-ladder"
    },
    {
      "house": "language-semantics-and-formal-shape",
      "house_name": "Language, Semantics, and Formal Shape",
      "total_entries": 137,
      "generated_draft_entries": 0,
      "reviewed_entries": 137,
      "canonical_entries": 0,
      "fully_reviewed": true,
      "next_tranche": "complete",
      "last_review_release": "v2.4.0-semantic-promotion-ladder"
    },
    {
      "house": "data-state-and-representation",
      "house_name": "Data, State, and Representation",
      "total_entries": 122,
      "generated_draft_entries": 104,
      "reviewed_entries": 18,
      "canonical_entries": 0,
      "fully_reviewed": false,
      "next_tranche": "review generated_draft entries with prompt-use and example gates",
      "last_review_release": "pending"
    },
    {
      "house": "transformation-algorithms-and-working-verbs",
      "house_name": "Transformation, Algorithms, and Working Verbs",
      "total_entries": 140,
      "generated_draft_entries": 120,
      "reviewed_entries": 20,
      "canonical_entries": 0,
      "fully_reviewed": false,
      "next_tranche": "review generated_draft entries with prompt-use and example gates",
      "last_review_release": "pending"
    },
    {
      "house": "control-flow-coordination-and-temporal-logic",
      "house_name": "Control Flow, Coordination, and Temporal Logic",
      "total_entries": 97,
      "generated_draft_entries": 79,
      "reviewed_entries": 18,
      "canonical_entries": 0,
      "fully_reviewed": false,
      "next_tranche": "review generated_draft entries with prompt-use and example gates",
      "last_review_release": "pending"
    },
    {
      "house": "runtime-memory-and-execution",
      "house_name": "Runtime, Memory, and Execution",
      "total_entries": 76,
      "generated_draft_entries": 62,
      "reviewed_entries": 14,
      "canonical_entries": 0,
      "fully_reviewed": false,
      "next_tranche": "review generated_draft entries with prompt-use and example gates",
      "last_review_release": "pending"
    },
    {
      "house": "systems-programming-and-operating-system-words",
      "house_name": "Systems Programming and Operating-System Words",
      "total_entries": 86,
      "generated_draft_entries": 74,
      "reviewed_entries": 12,
      "canonical_entries": 0,
      "fully_reviewed": false,
      "next_tranche": "review generated_draft entries with prompt-use and example gates",
      "last_review_release": "pending"
    },
    {
      "house": "networking-and-distributed-systems",
      "house_name": "Networking and Distributed Systems",
      "total_entries": 116,
      "generated_draft_entries": 96,
      "reviewed_entries": 20,
      "canonical_entries": 0,
      "fully_reviewed": false,
      "next_tranche": "review generated_draft entries with prompt-use and example gates",
      "last_review_release": "pending"
    },
    {
      "house": "databases-persistence-and-time-binding-words",
      "house_name": "Databases, Persistence, and Time-Binding Words",
      "total_entries": 82,
      "generated_draft_entries": 66,
      "reviewed_entries": 16,
      "canonical_entries": 0,
      "fully_reviewed": false,
      "next_tranche": "review generated_draft entries with prompt-use and example gates",
      "last_review_release": "pending"
    },
    {
      "house": "security-trust-and-warding-words",
      "house_name": "Security, Trust, and Warding Words",
      "total_entries": 95,
      "generated_draft_entries": 77,
      "reviewed_entries": 18,
      "canonical_entries": 0,
      "fully_reviewed": false,
      "next_tranche": "review generated_draft entries with prompt-use and example gates",
      "last_review_release": "pending"
    },
    {
      "house": "build-tooling-versioning-and-release",
      "house_name": "Build, Tooling, Versioning, and Release",
      "total_entries": 76,
      "generated_draft_entries": 60,
      "reviewed_entries": 16,
      "canonical_entries": 0,
      "fully_reviewed": false,
      "next_tranche": "review generated_draft entries with prompt-use and example gates",
      "last_review_release": "pending"
    },
    {
      "house": "testing-verification-and-observability",
      "house_name": "Testing, Verification, and Observability",
      "total_entries": 71,
      "generated_draft_entries": 55,
      "reviewed_entries": 16,
      "canonical_entries": 0,
      "fully_reviewed": false,
      "next_tranche": "review generated_draft entries with prompt-use and example gates",
      "last_review_release": "pending"
    },
    {
      "house": "hardware-embedded-and-performance-near-words",
      "house_name": "Hardware, Embedded, and Performance-Near Words",
      "total_entries": 80,
      "generated_draft_entries": 66,
      "reviewed_entries": 14,
      "canonical_entries": 0,
      "fully_reviewed": false,
      "next_tranche": "review generated_draft entries with prompt-use and example gates",
      "last_review_release": "pending"
    },
    {
      "house": "interface-ux-and-human-facing-words",
      "house_name": "Interface, UX, and Human-Facing Words",
      "total_entries": 60,
      "generated_draft_entries": 50,
      "reviewed_entries": 10,
      "canonical_entries": 0,
      "fully_reviewed": false,
      "next_tranche": "review generated_draft entries with prompt-use and example gates",
      "last_review_release": "pending"
    },
    {
      "house": "promptcraft-ai-oriented-engineering-and-spell-structure",
      "house_name": "Promptcraft, AI-Oriented Engineering, and Spell Structure",
      "total_entries": 70,
      "generated_draft_entries": 56,
      "reviewed_entries": 14,
      "canonical_entries": 0,
      "fully_reviewed": false,
      "next_tranche": "review generated_draft entries with prompt-use and example gates",
      "last_review_release": "pending"
    },
    {
      "house": "guarantee-words-quality-attributes-and-behavioral-adjectives",
      "house_name": "Guarantee Words, Quality Attributes, and Behavioral Adjectives",
      "total_entries": 92,
      "generated_draft_entries": 73,
      "reviewed_entries": 19,
      "canonical_entries": 0,
      "fully_reviewed": false,
      "next_tranche": "review generated_draft entries with prompt-use and example gates",
      "last_review_release": "pending"
    },
    {
      "house": "failure-words-pathologies-and-counter-spells",
      "house_name": "Failure Words, Pathologies, and Counter-Spells",
      "total_entries": 70,
      "generated_draft_entries": 50,
      "reviewed_entries": 20,
      "canonical_entries": 0,
      "fully_reviewed": false,
      "next_tranche": "review generated_draft entries with prompt-use and example gates",
      "last_review_release": "pending"
    },
    {
      "house": "compound-forms-prefixes-suffixes-and-naming-runes",
      "house_name": "Compound Forms, Prefixes, Suffixes, and Naming Runes",
      "total_entries": 63,
      "generated_draft_entries": 47,
      "reviewed_entries": 16,
      "canonical_entries": 0,
      "fully_reviewed": false,
      "next_tranche": "review generated_draft entries with prompt-use and example gates",
      "last_review_release": "pending"
    }
  ]
}
